{"title":"COLONY (2026)","premise":"체인스 바이오가 입주한 둥우리 빌딩에서 서영철이 집단 지성형 감염체를 퍼뜨린다. 건물 안의 권세정과 생존자들은 서영철을 유일한 백신으로 믿고 탈출시키려 하지만, 그가 감염자 전체를 조종하는 핵심 개체임을 알아내면서 그를 살릴지 제거할지 선택해야 한다.","characters":[{"name":"권세정","role":"집단 지성의 작동 원리를 해석하고 마지막 선택을 내리는 교수이자 중심 생존자"},{"name":"서영철","role":"생물학적 테러를 일으키고 자신을 유일한 백신이라고 주장하는 전 체인스 바이오 연구자"},{"name":"강우철","role":"체인스 바이오 대표이자 서영철과 연구 성과를 두고 갈등하는 최초 감염자"},{"name":"최현석","role":"둥우리 빌딩 보안 직원으로 누나 나윤과 함께 탈출에 나서는 생존자"},{"name":"나윤","role":"현석의 누나로 생존자들을 돕고 통제실에 남아 길을 안내하는 인물"},{"name":"규성","role":"권세정의 전남편으로 대피 과정에서 다른 사람들을 구하려다 희생되는 인물"},{"name":"이봉석","role":"서영철의 테러를 추적하는 서울청 대테러 팀장"},{"name":"공설희","role":"정부 특별 조사 팀에 참여하고 권세정의 마지막 판단을 지원하는 교수"},{"name":"소은","role":"괴롭힘을 당해 온 생존자로 위기 속에서 가해자의 사과를 받는 인물"}],"beats":[{"story_beat":"cold_open","start":63.822,"end":115.791,"summary":"서영철은 112에 전화해 둥우리 빌딩에서 전염성이 강한 생물학적 테러를 벌이겠다고 예고한다. 그는 균을 자기 몸에 시험했고 자신만이 사태를 막을 백신이라고 주장한다.","stakes":"테러범의 생존 여부가 감염 확산을 막을 유일한 수단처럼 제시된다.","key_dialogues":[{"start":114.331,"end":115.791,"text":"유일한 백신입니다.","reason":"서영철을 제거할 수 없는 존재로 믿게 만드는 영화 전체의 핵심 전제다."}],"sheet_numbers":[1]},{"story_beat":"setup","start":137.771,"end":477.193,"summary":"둥우리 빌딩의 체인스 바이오 컨퍼런스에서 강우철은 정보 교류와 학습이 가능한 생물 칩과 인간 사이의 정보 전달 가능성을 발표한다. 규성은 전처 권세정의 취업을 부탁하려 하고, 나윤은 빌딩에서 일하는 동생 현석과 평범한 일상을 나눈다.","stakes":"집단 지성 기술과 주요 인물들의 관계가 이후 감염 사태의 과학적·감정적 토대로 놓인다.","key_dialogues":[{"start":274.741,"end":277.869,"text":"집단 지성은 진화의 중요한 동력입니다.","reason":"컨퍼런스의 연구 주제와 뒤이어 등장할 감염체의 행동 원리를 직접 예고한다."}],"sheet_numbers":[1]},{"story_beat":"inciting_incident","start":482.073,"end":832.006,"summary":"이봉석은 강우철에게 서영철의 테러 계획을 경고한다. 강우철과 마주한 서영철은 훔친 연구 성과를 추궁하며 개별성이 사라진 신인류의 탄생을 선언하고, 얼마 뒤 경찰이 이상 증세를 보이는 사람을 발견해 봉쇄를 요청한다.","stakes":"서영철의 사상이 실제 감염 사태로 전환되고 빌딩 안의 모든 사람이 위험에 놓인다.","key_dialogues":[{"start":648.698,"end":654.537,"text":"멸종이 아니야, 형, 이거. 이거 탄생이야. 새로운 인류의 탄생.","reason":"서영철이 테러를 파괴가 아니라 인류 진화로 인식하고 있음을 드러낸다."}],"sheet_numbers":[1,2]},{"story_beat":"rising_action","start":840.306,"end":1250.174,"summary":"감염 사태가 번지면서 빌딩 전체에 대피 명령이 내려진다. 권세정, 규성, 나윤, 현석과 경찰을 포함한 생존자들이 한곳에 모이고, 감염자들이 사람을 공격하기 시작한다.","stakes":"서로 알지 못하던 인물들이 즉석에서 협력하지 않으면 감염자들에게 포위된다.","key_dialogues":[{"start":1191.365,"end":1197.788,"text":"오늘 이 건물에서 생물학적 테러가 있다는 정보가 있었어요. 저 사람들은 아마 그 테러의 영향인 거 같습니다.","reason":"혼란스러운 공격이 서영철의 생물학적 테러 결과임을 생존자들에게 확정한다."}],"sheet_numbers":[2,3]},{"story_beat":"rising_action","start":1269.526,"end":1823.038,"summary":"생존자들은 위험에 처한 학생들을 구하기 위해 감염자들을 유인한다. 규성은 사람들을 구하다 돌아오지 못하고, 당국은 빌딩을 완전히 격리해 외부 구조가 불가능하다고 통보한다.","stakes":"생존자들은 구조를 기다릴 수 없으며 스스로 탈출 조건을 만들어야 한다.","key_dialogues":[{"start":1916.548,"end":1924.806,"text":"지금 이 테러를 일으킨 서영철이라는 놈이 본인 몸에 백신을 주사해 놓은 상태라고 해요. 그놈을 찾아 데리고 나간다면 다 같이 구조될 수 있어요.","reason":"생존자들의 목표가 단순 대피에서 서영철 확보로 바뀌는 결정적 정보다."}],"sheet_numbers":[3,4]},{"story_beat":"rising_action","start":1841.139,"end":2699.622,"summary":"권세정은 감염자들이 정보를 교류하며 빠르게 진화한다고 판단한다. 생존자들은 서로 다른 냄새로 잘못된 정보를 주입하는 유인책을 실행하고, 위험한 이동 끝에 서영철이 있는 3층에 도착한다.","stakes":"권세정의 가설이 실패하면 생존자들은 감염자 무리 한가운데에서 전멸한다.","key_dialogues":[{"start":2004.552,"end":2007.764,"text":"그들이 만일 정보 교류를 하는 집단 지성체 상태라면 우리가 잘못된 정보를 입력시킬 수도 있을 거 같아요.","reason":"생존자들이 집단 지성의 약점을 이용해 처음으로 능동적인 작전을 세우는 순간이다."}],"sheet_numbers":[4,5]},{"story_beat":"reversal","start":2699.705,"end":3030.911,"summary":"생존자들은 서영철을 확보하지만 구조대가 있는 옥상까지 직접 데려가야 한다는 사실을 듣는다. 이동 중 서영철은 달아나고, 감염자들은 인간의 행동을 모방하기 시작한다. 일행은 CCTV 통제실에서 그를 추적하기로 한다.","stakes":"백신으로 믿은 서영철이 통제를 벗어나고 감염자들의 진화 속도도 빨라진다.","key_dialogues":[{"start":2959.506,"end":2966.513,"text":"저 새끼가 백신이라고 했어. 방금 봤잖아. 그 감염된 놈들이 건드리지도 않는 거. 저 백신을 데리고 나가야 된다고!","reason":"감염자들이 서영철을 공격하지 않는 현상이 그의 백신 주장에 신빙성을 더한다."}],"sheet_numbers":[5,6]},{"story_beat":"rising_action","start":3042.881,"end":3598.353,"summary":"특별 조사 팀은 서영철의 연구실에서 살아 있는 실험 개체들을 발견한다. 통제실에 도착한 생존자들은 서영철이 감염자들의 시야를 공유하고 있음을 추론하고, 그가 최초 감염자로 보이는 강우철을 찾아가는 모습을 확인한다.","stakes":"서영철은 추적당하는 표적이 아니라 감염망 전체를 통해 생존자들을 감시하는 존재일 수 있다.","key_dialogues":[{"start":3430.685,"end":3440.487,"text":"만약 서영철이 감염된 사람들을 통해 보고 있다면... 이 괴물 새끼들이 보고 있는 거를 서영철도 똑같이 볼 수 있다는 거예요?","reason":"서영철과 감염자들의 연결 가능성을 처음 명확하게 제기한다."}],"sheet_numbers":[6]},{"story_beat":"reversal","start":3608.655,"end":3832.212,"summary":"강우철에게 물린 서영철은 감염자들과 직접 소통하고 그들을 조종할 수 있게 된다. 생존자들은 그에게 계획을 들키지 않기 위해 대화를 멈추고 문자만 사용한다.","stakes":"백신으로 데려가야 할 대상이 감염자 집단의 지휘자가 되면서 탈출 작전의 전제가 무너진다.","key_dialogues":[{"start":3816.696,"end":3826.831,"text":"아까 강우철한테 물린 이후로 저놈들하고 소통할 수 있게 된 거 같아요. 잠깐만, 그럼 이 새끼가 밖에 있는 괴물 같은 새끼들을 다 조종할 수 있단 얘기잖아.","reason":"서영철이 감염망의 능동적인 조종자라는 중반의 핵심 반전이다."}],"sheet_numbers":[7]},{"story_beat":"crisis","start":3846.643,"end":4262.099,"summary":"서영철을 데리고 옥상으로 가려는 사람들과 통제실에 남은 나윤을 구하려는 현석 사이에 갈등이 벌어진다. 현석은 누나에게 돌아가려 하지만, 나윤은 자신이 늦었다며 동생에게 일행을 따라가라고 마지막 길을 알려 준다.","stakes":"공동체의 생존과 가족 구출이 충돌하고, 현석은 누나를 남겨 둔 채 살아남아야 한다.","key_dialogues":[{"start":4019.273,"end":4022.276,"text":"미안하지만 당신 누나는 포기해.","reason":"백신 확보를 위해 개인을 희생시키려는 생존 집단의 냉혹한 논리를 드러낸다."},{"start":4208.17,"end":4211.09,"text":"넌 꼭 살아 나가. 누난 늦었어.","reason":"나윤이 자신의 구조를 포기하고 현석을 살리는 감정적 위기의 정점이다."}],"sheet_numbers":[7,8]},{"story_beat":"rising_action","start":4308.604,"end":5006.76,"summary":"정부는 감염자의 회복 가능성이 희박하다는 판단 아래 진압 명분을 만들려 한다. 실험실의 1번 원숭이를 죽이자 다른 원숭이들이 멈춘 사실을 근거로 최초 감염자를 제거하는 작전을 세우고, CCTV 분석을 통해 강우철을 최초 감염자로 지목한다.","stakes":"강우철을 제거하면 감염자 전체를 멈출 수 있다는 미검증 가설에 수많은 생명이 걸린다.","key_dialogues":[{"start":4463.384,"end":4468.222,"text":"1번이라고 표시된 원숭이를 죽였더니 모든 원숭이들이 움직임을 멈췄습니다.","reason":"정부가 최초 감염자 제거 작전을 선택하게 되는 직접적인 실험 근거다."},{"start":5004.216,"end":5006.76,"text":"체인스 바이오 강우철 대표가 최초 감염자였어요.","reason":"진압 작전의 목표물이 강우철로 확정되는 순간이다."}],"sheet_numbers":[8,9]},{"story_beat":"reversal","start":5006.76,"end":5492.62,"summary":"생존자들은 구조대와 연락해 서영철의 위치를 넘기고, 진압 팀은 강우철을 사살한다. 그러나 감염자들은 멈추지 않고 구조 팀을 공격하며, 혼란 속에서 서영철이 다시 모습을 드러낸다.","stakes":"최초 감염자 제거 가설이 실패하면서 정부의 구조 작전과 생존자들의 마지막 희망이 동시에 붕괴한다.","key_dialogues":[{"start":5451.579,"end":5463.424,"text":"확인 사살 완료. 이제, 이제 끝난 거지? 다 멈춘 거지? 저거 뭐야?","reason":"강우철 사살이 해결책이 아니었음을 즉시 보여 주는 반전 대사다."}],"sheet_numbers":[9,10]},{"story_beat":"reversal","start":5548.259,"end":6112.448,"summary":"서영철은 권세정에게 과거의 연구비 사건을 소통의 불완전함이 만든 비극이라고 주장한다. 그는 모든 인간의 뇌를 하나로 연결하는 것이 해답이라고 선언한다. 권세정은 실험의 1번이 최초 감염자가 아니라 다른 개체를 조종하는 개체였으며, 인간 감염망의 1번은 서영철임을 알아낸다.","stakes":"서영철은 백신인 동시에 감염자 전체를 움직이는 핵심 개체이며, 그를 살려 보내면 집단 감염이 외부로 확산된다.","key_dialogues":[{"start":5887.765,"end":5895.064,"text":"결국 그런 비극을 모두 막을 수 있는 방법은 우리 모두의 뇌를 하나로 연결하는 거예요.","reason":"서영철이 테러를 감행한 사상적 목적을 직접 밝힌다."},{"start":6101.353,"end":6112.448,"text":"그 1번 원숭이는 최초로 감염된 원숭이가 아니라 나머지 원숭이를 조종하는 원숭이예요. 그렇다면 그 1번 원숭이는 서영철 본인이에요.","reason":"백신 서사가 뒤집히고 진짜 제거 목표가 서영철로 확정되는 최종 반전이다."}],"sheet_numbers":[10,11]},{"story_beat":"crisis","start":6113.574,"end":6581.291,"summary":"권세정은 서영철을 즉시 제거해야 한다고 알리지만, 정부는 유일한 백신을 죽였을 때의 정치적 책임과 확실한 근거 부족을 이유로 명령을 거부한다. 서영철이 건물 밖으로 탈출하자 봉쇄가 무너지고 대책 본부도 대피한다.","stakes":"서영철이 인구 밀집 지역으로 빠져나가면 감염자 집단과 통제 범위가 건물 밖으로 확장된다.","key_dialogues":[{"start":6164.708,"end":6171.632,"text":"지금 당장 서영철을 죽이라고 하세요. 그러면 저놈들 전부 다 멈출 수 있어요. 서영철이 밖으로 나가면 다 끝이라고요.","reason":"정부가 결단하지 않으면 사태가 전국적으로 확산될 수 있다는 최종 선택을 제시한다."}],"sheet_numbers":[11]},{"story_beat":"climax","start":6604.064,"end":7021.648,"summary":"정부의 결정을 기다릴 수 없게 된 권세정은 공설희의 위치 안내를 받아 탈출한 서영철을 추적한다. 서영철이 제거되자 감염자들은 처음 상태로 돌아간 뒤 모두 멈추고, 작전의 성공이 확인된다.","stakes":"권세정이 백신으로 알려진 서영철을 직접 없애지 못하면 감염을 멈출 마지막 기회를 잃는다.","key_dialogues":[{"start":6830.207,"end":6831.625,"text":"처음 상태로 돌아갔어.","reason":"서영철의 통제가 끊기며 감염망의 학습 상태가 초기화됐음을 보여 준다."},{"start":7018.978,"end":7021.648,"text":"네, 멈췄어요.","reason":"서영철 제거로 감염자 전체가 정지했음을 확정하는 결과 대사다."}],"sheet_numbers":[12]},{"story_beat":"resolution","start":7023.942,"end":7061.688,"summary":"권세정은 세상이 자신을 유일한 백신을 없앤 사람으로 비난할 것이라고 예상한다. 공설희는 함께 증언하고 비난도 나누겠다고 약속하며, 두 사람은 앞으로 해결해야 할 일이 많다는 데 뜻을 모은다.","stakes":"사태는 멈췄지만 권세정은 자신의 판단을 입증하고 감염의 후속 문제를 감당해야 한다.","key_dialogues":[{"start":7031.783,"end":7035.412,"text":"진짜로 백신을 없앴으니 나 진짜 미움받게 생겼네.","reason":"권세정의 선택이 옳았음에도 사회적 책임과 비난이 남았음을 보여 준다."},{"start":7041.876,"end":7045.213,"text":"미움받을 일 생기면 같이 받아 줄게요.","reason":"고립에 익숙했던 권세정이 처음으로 책임을 함께 질 동료를 얻는다."},{"start":7059.644,"end":7061.688,"text":"앞으로 우리가 할 일이 많을 거 같은데요.","reason":"감염 이후의 조사와 수습이 계속될 것임을 암시하며 이야기를 닫는다."}],"sheet_numbers":[12]}]}