{"title":"콘스탄틴: 지옥을 피하려던 남자의 자기희생","premise":"폐암으로 죽음을 앞둔 퇴마사 존 콘스탄틴은 형사 안젤라의 쌍둥이 동생이 남긴 단서를 추적하다가, 사탄의 아들 마몬을 인간 세상에 강림시키려는 음모와 자신이 믿었던 가브리엘의 배신을 마주한다.","characters":[{"name":"존 콘스탄틴","role":"지옥행을 피하려 악령을 퇴치해 온 주인공. 안젤라와 함께 마몬의 강림 음모를 추적하며 진정한 자기희생에 도달한다."},{"name":"안젤라 도슨","role":"이사벨의 죽음을 조사하는 형사이자 강력한 영매. 마몬 강림에 필요한 숙주로 지목된다."},{"name":"이사벨 도슨","role":"안젤라의 쌍둥이 동생. 지옥에서 암호와 단서를 남겨 마몬의 계획을 경고한다."},{"name":"채즈 크레이머","role":"콘스탄틴의 운전기사이자 견습생. 마지막 결전에 직접 참여한다."},{"name":"가브리엘","role":"인간에게 극심한 고통을 주어 구원의 자격을 증명시키려는 신념으로 마몬의 강림을 추진한 배후 인물."},{"name":"루시퍼","role":"콘스탄틴의 영혼을 탐내는 지옥의 지배자. 마몬의 배신을 알게 되자 강림을 저지한다."},{"name":"마몬","role":"루시퍼의 아들. 숙명의 창과 강력한 영매를 이용해 인간 세계에 자신의 왕국을 세우려 한다."},{"name":"파파 미드나잇","role":"천국과 지옥 사이의 중립을 지키는 클럽 주인. 위기가 명백해지자 콘스탄틴을 돕는다."},{"name":"발사자르","role":"마몬의 계획에 가담한 혼혈 악마. 심문 끝에 숙명의 창과 안젤라의 역할을 폭로한다."},{"name":"비먼","role":"지옥 성경을 해독해 마몬의 강림 계획을 밝혀내고 살해당하는 콘스탄틴의 조력자."}],"beats":[{"story_beat":"cold_open","start":0,"end":180,"summary":"멕시코에서 2차 대전 이후 사라졌던 숙명의 창이 발견된다. 창을 가진 자가 세계의 운명을 좌우한다는 예언이 앞으로 닥칠 재앙의 원인을 먼저 제시한다.","stakes":"숙명의 창이 악의 세력에 넘어가면 인간 세계의 운명 자체가 바뀔 수 있다.","key_dialogues":[{"start":0,"end":180,"text":"숙명의 창을 갖는 자 세상의 운명을 좌우하리라","reason":"영화 전체를 관통하는 위험물과 종말적 위기를 설정한다."}],"sheet_numbers":[1]},{"story_beat":"setup","start":180,"end":720,"summary":"로스앤젤레스의 퇴마사 콘스탄틴은 한 여성의 몸을 차지한 악령을 거울에 가둔다. 퇴마에는 성공하지만, 악령이 인간을 단순히 조종한 것이 아니라 몸을 통로로 이승에 나오려 했다는 비정상적인 징후를 포착한다.","stakes":"천국과 지옥의 기존 규칙이 깨졌다면 이번 사건은 평범한 빙의가 아니라 더 큰 침공의 시작이다.","key_dialogues":[{"start":360,"end":540,"text":"정체를 드러내라","reason":"콘스탄틴의 퇴마 능력과 악령에 맞서는 방식을 보여준다."},{"start":540,"end":720,"text":"오늘 미흡했어요","reason":"성공한 듯한 퇴마 뒤에도 위기가 끝나지 않았음을 암시한다."}],"sheet_numbers":[1,2]},{"story_beat":"inciting_incident","start":720,"end":1080,"summary":"폐암이 빠르게 전이된 콘스탄틴은 죽음을 준비하라는 진단을 받는다. 같은 시각, 형사 안젤라는 정신병원에서 추락한 쌍둥이 동생 이사벨의 시신을 확인하고 공식 결론인 자살을 완강히 부정한다.","stakes":"콘스탄틴에게는 사건을 해결하고 자신의 운명을 바꿀 시간이 얼마 남지 않았으며, 이사벨의 죽음은 풀리지 않은 초자연적 미스터리가 된다.","key_dialogues":[{"start":720,"end":900,"text":"이깐 담배한테 지다니∙∙∙","reason":"무수한 악령에게 살아남은 콘스탄틴에게 현실적인 죽음의 시한을 부여한다."},{"start":900,"end":1080,"text":"얜 절대 자살 안 해요","reason":"안젤라가 공식 수사를 거부하고 진실을 추적하게 되는 출발점이다."}],"sheet_numbers":[2]},{"story_beat":"rising_action","start":1080,"end":1620,"summary":"콘스탄틴은 악령이 인간의 몸을 통해 이승으로 나오려 했던 전례를 조사한다. 가브리엘에게 수명 연장과 천국행을 요구하지만, 그의 퇴마는 타인을 위한 희생이 아니라 자기 구원을 위한 거래였다는 이유로 거절당한다. 직후 안젤라가 이사벨 사건을 의뢰하면서 두 사람의 이야기가 합쳐진다.","stakes":"구원을 얻을 방법이 막힌 콘스탄틴은 죽기 전에 규칙을 깨고 들어오는 악마와 이사벨의 죽음 사이의 연결을 찾아야 한다.","key_dialogues":[{"start":1080,"end":1260,"text":"여자애 몸에 들어간 악령이 이승으로 나오려 했어요","reason":"기존의 초자연적 질서가 무너지고 있다는 핵심 증거다."},{"start":1260,"end":1440,"text":"다 너 자신을 위한 거지","reason":"콘스탄틴이 구원받지 못하는 내적 이유와 이후 변화의 기준을 제시한다."}],"sheet_numbers":[2,3]},{"story_beat":"rising_action","start":1620,"end":2160,"summary":"콘스탄틴은 천국과 지옥 양쪽의 중립지대인 미드나잇의 클럽을 찾아간다. 그는 악마가 직접 이승에 들어왔다고 경고하지만, 미드나잇은 휴전 규칙상 불가능하다며 협력을 거부한다. 발사자르의 도발까지 이어지며 기존 질서의 균열이 선명해진다.","stakes":"중립 세력이 움직이지 않는 동안 악마들의 규칙 위반은 아무런 제지도 받지 않게 된다.","key_dialogues":[{"start":1800,"end":1980,"text":"혼혈종이 아냐 악마가 이승에 들어왔다구","reason":"이번 사태가 기존 규칙으로 설명할 수 없는 침공임을 선언한다."},{"start":1980,"end":2160,"text":"어제 동생이 살해됐어요","reason":"안젤라의 개인적 사건이 콘스탄틴의 초자연적 조사와 본격적으로 연결된다."}],"sheet_numbers":[3,4]},{"story_beat":"rising_action","start":2520,"end":3240,"summary":"콘스탄틴은 고양이를 매개로 지옥의 경계를 넘어 이사벨이 실제로 자살했고 지옥에 있음을 확인한다. 그는 안젤라에게 자신도 자살로 잠시 지옥을 경험했으며, 천사와 악마의 혼혈종을 퇴치해 온 이유가 자신의 지옥행을 피하기 위해서였다고 고백한다. 이어 이사벨이 쌍둥이만 이해할 메시지를 남겼다고 추론한다.","stakes":"이사벨의 자살이 사실이라면, 그녀가 목숨을 버리면서까지 안젤라에게 전하려 한 경고를 반드시 찾아야 한다.","key_dialogues":[{"start":2520,"end":2700,"text":"자살한 게 맞소","reason":"살인 의혹을 뒤집고 사건의 초점을 이사벨이 자살한 진짜 이유로 이동시킨다."},{"start":2880,"end":3060,"text":"난 이제 곧 죽어요 / 죽어서 내가 갈 덴 한 곳뿐이오","reason":"콘스탄틴의 행동을 지배하는 지옥에 대한 공포를 드러낸다."},{"start":3060,"end":3240,"text":"또 남긴 게 있을 거요 경찰은 찾을 수 없는 것∙∙∙ / 당신만이 알 수 있는 것∙∙∙","reason":"쌍둥이의 기억이 수사의 결정적 열쇠임을 제시한다."}],"sheet_numbers":[5,6]},{"story_beat":"reversal","start":3240,"end":3600,"summary":"안젤라는 자매가 유리창에 남기던 방식으로 ‘고린도 전서 17장 1절’이라는 암호를 발견한다. 비먼은 지옥 성경을 통해 사탄의 아들 마몬이 강력한 영매의 몸과 신의 도움을 이용해 이승에 오려 한다는 예언을 해독한다. 곧 비먼이 살해되고, 안젤라는 자신도 이사벨과 같은 존재들을 볼 수 있었다고 고백한다.","stakes":"단순한 자살 조사는 마몬의 강림으로 인간 세계 전체가 위협받는 종말적 사건으로 반전된다.","key_dialogues":[{"start":3240,"end":3420,"text":"아뇨, 그 반대 사탄의 아들∙∙∙","reason":"사건의 진짜 적이 마몬임을 공개하는 중대한 반전이다."},{"start":3420,"end":3600,"text":"내게도 보였어요 / 이사벨이 본 것들∙∙∙","reason":"안젤라가 강력한 영매일 가능성을 처음으로 드러낸다."}],"sheet_numbers":[6]},{"story_beat":"rising_action","start":3600,"end":4140,"summary":"동생을 외면했다는 죄책감에 시달리던 안젤라는 직접 지옥의 경계를 보겠다고 선택한다. 콘스탄틴의 물 의식으로 영적 감각을 되찾은 그녀는 악마를 감지하는 능력과 자신의 뛰어난 사격이 연결돼 있었음을 깨닫는다. 이어 발사자르가 남긴 흔적을 감지하고, 콘스탄틴은 살해된 동료들의 복수를 위해 그를 추적한다.","stakes":"안젤라는 진실을 볼 힘을 얻지만, 동시에 악마들도 그녀를 찾아낼 수 있는 위험한 존재가 된다.","key_dialogues":[{"start":3600,"end":3780,"text":"난 걜 버려뒀어요 / 혼자 외롭게∙∙∙ / 그곳에 보내줘요","reason":"안젤라가 안전보다 진실과 속죄를 선택하는 순간이다."},{"start":3780,"end":3960,"text":"난 알고 있었던 거예요 / 저들을 보는 능력이 내게 있음을","reason":"안젤라의 억눌렸던 영적 능력이 완전히 각성했음을 확인한다."}],"sheet_numbers":[7]},{"story_beat":"reversal","start":4140,"end":4680,"summary":"콘스탄틴은 발사자르를 붙잡고 악마에게 가장 끔찍한 운명인 천국행을 무기로 심문한다. 발사자르는 예수의 피가 묻은 숙명의 창과 강력한 영매가 마몬 탄생의 조건이라고 폭로한다. 더 나아가 진짜 표적은 안젤라였으며, 콘스탄틴의 의식이 그녀를 완전한 영매로 각성시켰다고 조롱한다. 직후 안젤라는 납치된다.","stakes":"안젤라를 돕기 위해 행한 의식이 오히려 적의 마지막 조건을 완성했고, 마몬의 강림이 임박한다.","key_dialogues":[{"start":4140,"end":4320,"text":"천국에 간 악마! / 어떨지 구경하고 싶군","reason":"열세였던 콘스탄틴이 구원을 심문 도구로 바꾸어 주도권을 잡는다."},{"start":4320,"end":4500,"text":"내 표적은 안젤라였는데 / 네 손으로 내게 보냈잖아","reason":"콘스탄틴의 성공처럼 보였던 각성이 치명적인 실수였음을 뒤집어 밝힌다."},{"start":4500,"end":4680,"text":"사람들이 죽어가도 중립만 중요해?","reason":"콘스탄틴이 미드나잇의 중립을 흔들고 최종 추적에 필요한 도움을 얻는 계기다."}],"sheet_numbers":[7,8]},{"story_beat":"crisis","start":5040,"end":5580,"summary":"미드나잇의 도움으로 안젤라의 위치를 찾아낸 콘스탄틴은 채즈와 함께 결전에 들어간다. 그는 균형의 규칙을 깬 혼혈종들을 성수로 몰아내지만, 안젤라의 몸 안에서 마몬이 나오려 하면서 전투의 초점은 그녀를 구하는 일로 좁혀진다.","stakes":"마몬이 안젤라의 몸을 통해 태어나기 전에 그녀를 구하지 못하면 인간 세계가 지옥의 왕국으로 변한다.","key_dialogues":[{"start":5040,"end":5220,"text":"책과 현실은 달라","reason":"채즈와 콘스탄틴이 실제 지옥의 세력과 맞설 결전의 위험을 강조한다."},{"start":5220,"end":5400,"text":"너희는 '균형'의 규칙을 깼다","reason":"콘스탄틴이 휴전을 위반한 혼혈종들에게 최후통첩을 내린다."},{"start":5400,"end":5580,"text":"꺼내줘요","reason":"안젤라 내부에서 진행되는 강림을 막아야 하는 절박함을 압축한다."}],"sheet_numbers":[9,10]},{"story_beat":"reversal","start":5580,"end":5940,"summary":"콘스탄틴이 빛으로 나오라고 명령하자 진짜 배후인 가브리엘이 모습을 드러낸다. 가브리엘은 인간에게만 회개와 죄사함이 허락되는 것을 불공평하다고 여기며, 사람들이 악마의 지배와 고통을 이겨내야 은총을 받을 자격이 생긴다는 왜곡된 신념으로 마몬의 강림을 추진해 왔다.","stakes":"가브리엘은 천사의 힘과 숙명의 창을 모두 쥐고 있어 콘스탄틴의 물리적 수단으로는 막기 어렵다.","key_dialogues":[{"start":5580,"end":5760,"text":"가브리엘 너였군","reason":"악마들의 침공 뒤에 있던 예상 밖의 배후를 공개한다."},{"start":5760,"end":5940,"text":"악마가 지배하는 세상을 견딘 자만이 은총을 받을 자격이 있어","reason":"가브리엘이 마몬의 강림을 돕는 왜곡된 동기를 설명한다."},{"start":5760,"end":5940,"text":"전 버린 자식인 거 압니다 / 허나 좀 도와주세요","reason":"콘스탄틴이 자신의 구원과 무관하게 타인을 위해 도움을 청하기 시작했음을 보여준다."}],"sheet_numbers":[10]},{"story_beat":"climax","start":5940,"end":6300,"summary":"가브리엘이 마몬을 풀어놓으려는 순간, 콘스탄틴은 손목을 그어 루시퍼를 직접 불러낸다. 자신의 영혼을 거두러 온 루시퍼에게 마몬이 가브리엘과 숙명의 창을 이용해 아버지의 영역을 빼앗으려 한다고 알린다. 이해관계가 뒤집힌 루시퍼는 강림을 중단시키고 아들을 지옥으로 데려간다.","stakes":"콘스탄틴의 계략이 실패하면 그는 죽어 지옥으로 끌려가고 마몬까지 인간 세계에 풀려난다.","key_dialogues":[{"start":5940,"end":6120,"text":"당신 아들이 아버질 빼닮았더군 / 지금 옆방에 있어","reason":"콘스탄틴이 자신의 죽음을 루시퍼를 유인하고 조종하는 마지막 수단으로 바꾼다."},{"start":6120,"end":6300,"text":"가브리엘과 있어 / '숙명의 창'을 갖고 있어 / 직접 가서 확인해","reason":"마몬의 배신을 구체적으로 알려 루시퍼의 개입을 끌어낸다."},{"start":6120,"end":6300,"text":"이 세상은 내 꺼야, 당분간 / 집에 가자, 아들아","reason":"루시퍼가 자신의 영역을 지키기 위해 마몬의 강림을 최종 저지한다."}],"sheet_numbers":[10,11]},{"story_beat":"resolution","start":6300,"end":6840,"summary":"보상을 묻는 루시퍼에게 콘스탄틴은 생명 연장 대신 이사벨을 천국으로 보내달라고 요구한다. 자기 구원이 아닌 타인의 구원을 택한 희생으로 그는 오히려 지옥에서 벗어나 살아난다. 인간이 된 가브리엘은 안젤라에게 복수를 부추기지만, 안젤라는 그를 죽이지 않고 인간의 고통을 직접 겪게 한다. 콘스탄틴은 숙명의 창을 안젤라에게 맡기고 신의 계획을 받아들인다.","stakes":"마몬의 강림 이후에도 콘스탄틴이 진정으로 변화했는지, 숙명의 창이 다시 악용되지 않을지가 마지막 과제로 남는다.","key_dialogues":[{"start":6300,"end":6480,"text":"안젤라의 동생 이사벨 / 천국으로 보내줘","reason":"콘스탄틴이 처음으로 자신의 생명보다 타인의 구원을 선택한다."},{"start":6300,"end":6480,"text":"자기 희생! / 넌 살아야 돼","reason":"진정한 희생이 콘스탄틴의 운명을 역전시킨다."},{"start":6480,"end":6660,"text":"그래 / 그게 '고통'이야","reason":"안젤라가 살인을 거부하면서 가브리엘의 논리를 인간의 삶으로 되돌려준다."},{"start":6660,"end":6840,"text":"숨겨놔요 / 나도 못 찾을 곳","reason":"숙명의 창을 다시 사용할 수 없도록 감추는 후속 임무를 확정한다."},{"start":6660,"end":6840,"text":"모든 건 신의 계획 하에 있다","reason":"콘스탄틴이 신의 뜻을 거래하거나 거부하던 태도에서 받아들이는 태도로 변했음을 마무리한다."}],"sheet_numbers":[11,12]},{"story_beat":"resolution","start":7020,"end":7200,"summary":"시간이 흐른 뒤 채즈 크레이머의 이름이 제시되고, 콘스탄틴은 끝까지 함께 싸운 견습생의 공로를 인정한다.","stakes":"희생된 조력자의 존재와 결전의 대가가 기억된다.","key_dialogues":[{"start":7020,"end":7200,"text":"'채즈 크레이머' / 자네 제법이었어","reason":"채즈를 단순한 운전기사가 아닌 인정받은 동료로 추모한다."}],"sheet_numbers":[12,13]}]}